{
  "contract_version": "ai-video-artifact-v1",
  "artifact_id": "PROJECT_CANON_MANIFEST_PROJECT_001",
  "owner_skill": "ai-video-shot-script-director",
  "version": "0.1.0",
  "sha256": null,
  "approval_status": "draft",
  "dependencies": [],
  "affected_shot_uids": [],
  "stale_reason": null,
  "schema_version": "ai-video-project-canon-manifest.v1",
  "project_id": "PROJECT_001",
  "manifest_role": "artifact_registry_only",
  "manifest_update_policy": "validated_atomic_delta_no_reverse_dependency",
  "current_phase": "intake",
  "revision_counter": 0,
  "updated_by_skill": "ai-video-shot-script-director",
  "base_manifest_sha256": null,
  "canonical_shot_uids": [],
  "active_artifacts": [],
  "superseded_artifacts": [],
  "dependency_edges": [],
  "stale_events": [],
  "unresolved_change_requests": []
}
